### ISSUE TITLE
Sometimes resets connection instead of retrieving banner

### ISSUE THREAD

**Issue by githubparser** [robertdavidgraham/masscan#133]
I've noticed that for a lot of hosts, masscan does not record proper banner detail when I run in Ubuntu, compared to OS X.  Instead, it sends a reset packet.   For example, scanning port 22 on 64.180.81.197:

```
sudo masscan --banners 64.180.81.197 -p 22
```

Broken (Ubuntu):
```
22:20:25.499697 IP Scanner.48825 > 64.180.81.197.22: Flags [S], seq 2668587924, win 1024, length 0
22:20:25.544191 IP 64.180.81.197.22 > Scanner.48825: Flags [S.], seq 2276952563, ack 2668587925, win 4128, options [mss 536], length 0
22:20:25.544220 IP Scanner.48825 > 64.180.81.197.22: Flags [R], seq 2668587925, win 0, length 0
22:20:25.544296 IP Scanner.48825 > 64.180.81.197.22: Flags [.], ack 1, win 1200, length 0
22:20:25.587166 IP 64.180.81.197.22 > Scanner.48825: Flags [R], seq 2276952564, win 0, length 0
```

Working (OS X):
```
21:17:56.928091 IP 10.0.1.4.48675 > 64.180.81.197.22: Flags [S], seq 2661271461, win 1024, length 0
21:17:57.061959 IP 64.180.81.197.22 > 10.0.1.4.48675: Flags [S.], seq 637624112, ack 2661271462, win 4128, options [mss 536], length 0
21:17:57.934641 IP 10.0.1.4.48675 > 64.180.81.197.22: Flags [.], ack 1, win 600, length 0
21:17:57.973210 IP 64.180.81.197.22 > 10.0.1.4.48675: Flags [P.], seq 1:21, ack 1, win 4128, length 20
```

I've tried a few different builds.  It looks like it tries to complete the 3-way at the same time that it's resetting..?  On other IPs that are otherwise identical systems, it works fine.

On a60cc7046b ..

Mildly puzzling.   Any suggestions?

**Comment by githubparser** [comment]
I figured out that it was OS stack interference by using *strace* on masscan, but today I actually found that this is already captured in in the manpage document (woops!):

From the manpage file (masscan.8):

**SPURIOUS RESETS**
       *When scanning TCP using the default IP address of your adapter, the built-in stack will generate RST packets. This will prevent banner grabbing.  There  are  are  two
       ways  to  solve this.* [...]

I won't post the full explanation here, but this is a known and documented behaviour.  Might be worth adding a note in the README.md under bannering, or suggesting in README.md to also read the manpage.
